{
  "schema_version": 2,
  "id": "phase8_flying_standard",
  "name": "Original Flyer",
  "game": "original",
  "role": "support",
  "body_template": "flying_standard",
  "rig_template": "flying_standard",
  "animation_profile": "flying_standard",
  "animation_packs": [
    "flying_standard_core"
  ],
  "export_profile": "godot_character",
  "source": {
    "mode": "assembly",
    "asset_ids": [
      "p8_flying_body",
      "p8_flying_head",
      "p8_flying_wing_l",
      "p8_flying_wing_r",
      "p8_flying_tail"
    ]
  },
  "height_voxels": 64,
  "palette_profile": "phase8_original",
  "accent_colors": [
    "#4C78A8",
    "#F2CF5B"
  ],
  "export_formats": [
    "glb"
  ],
  "render_profile": "character_preview",
  "render_resolution": 512,
  "target_height_meters": 2.0,
  "settings_overrides": {
    "deformation": {
      "mode": "deform",
      "max_influences": 4,
      "normalize_weights": true,
      "secondary_solver": "spring_bones",
      "bake": true,
      "fallback": "rigid"
    },
    "optimization": {
      "lod_ratios": [
        1,
        0.5,
        0.25
      ],
      "material_batching": "palette_atlas",
      "compression": "engine",
      "incremental_previews": true
    },
    "spring_motion": [
      {
        "chain_id": "wings",
        "bones": [
          "wing_l",
          "wing_r"
        ],
        "stiffness": 0.55,
        "damping": 0.35,
        "max_angle_degrees": 18,
        "solver": "deterministic_spring",
        "bake": true,
        "fallback": "rigid"
      },
      {
        "chain_id": "tail",
        "bones": [
          "tail"
        ],
        "stiffness": 0.4,
        "damping": 0.5,
        "max_angle_degrees": 24,
        "solver": "deterministic_spring",
        "bake": true,
        "fallback": "rigid"
      }
    ]
  },
  "notes": "Original CC0 Phase 8 advanced-topology acceptance fixture."
}
