{
  "schema_version": 2,
  "id": "phase8_final_boss_composite",
  "name": "Original Final Boss",
  "game": "original",
  "role": "boss",
  "body_template": "final_boss_composite",
  "rig_template": "final_boss_composite",
  "animation_profile": "final_boss_composite",
  "animation_packs": [
    "final_boss_composite_core"
  ],
  "export_profile": "godot_character",
  "source": {
    "mode": "assembly",
    "asset_ids": [
      "boss_core",
      "boss_crown",
      "boss_torso_upper",
      "boss_torso_lower",
      "boss_wing_l",
      "boss_wing_r"
    ]
  },
  "height_voxels": 64,
  "palette_profile": "phase8_original",
  "accent_colors": [
    "#4C78A8",
    "#F2CF5B"
  ],
  "export_formats": [
    "glb"
  ],
  "render_profile": "character_preview",
  "render_resolution": 512,
  "target_height_meters": 4.0,
  "settings_overrides": {
    "deformation": {
      "mode": "rigid",
      "max_influences": 4,
      "normalize_weights": true,
      "secondary_solver": "none",
      "bake": true,
      "fallback": "rigid"
    },
    "optimization": {
      "lod_ratios": [
        1,
        0.5,
        0.25
      ],
      "material_batching": "palette_atlas",
      "compression": "engine",
      "incremental_previews": true
    },
    "spring_motion": [
      {
        "chain_id": "appendages",
        "bones": [
          "appendage_l",
          "appendage_r"
        ],
        "stiffness": 0.7,
        "damping": 0.4,
        "max_angle_degrees": 12,
        "solver": "deterministic_spring",
        "bake": true,
        "fallback": "rigid"
      }
    ],
    "boss_composition": {
      "composition_id": "original_final_boss",
      "attachments": [
        {
          "id": "core",
          "asset_id": "boss_core",
          "parent": null,
          "socket": "phase_root"
        },
        {
          "id": "crown",
          "asset_id": "boss_crown",
          "parent": "core",
          "socket": "head_socket"
        },
        {
          "id": "wing_l",
          "asset_id": "boss_wing_l",
          "parent": "core",
          "socket": "wing_socket_l"
        },
        {
          "id": "wing_r",
          "asset_id": "boss_wing_r",
          "parent": "core",
          "socket": "wing_socket_r"
        }
      ],
      "phases": [
        {
          "phase_id": "sealed",
          "enabled": [
            "core",
            "crown"
          ]
        },
        {
          "phase_id": "awakened",
          "enabled": [
            "core",
            "crown",
            "wing_l",
            "wing_r"
          ]
        },
        {
          "phase_id": "desperate",
          "enabled": [
            "core",
            "wing_l",
            "wing_r"
          ]
        }
      ],
      "budgets": {
        "max_bones": 192,
        "max_objects": 64,
        "max_triangles": 250000
      }
    }
  },
  "notes": "Original CC0 Phase 8 advanced-topology acceptance fixture."
}
